{
  "schema_version": "agent-e2e-case-v1",
  "dataset_id": "cst-agent-e2e-frozen-dev-v1",
  "split": "frozen_evaluation",
  "dataset_role": "developer_visible_frozen_evaluation",
  "frozen_at": "2026-08-10T12:00:00+08:00",
  "annotation_policy": "Developer-authored machine-checkable oracles. Tool names, exact sequences, arguments, failure consumption and recovery are deterministic checks; response facts remain lexical and require separate semantic claim review.",
  "generation_provenance": {
    "authoring_method": "developer_authored_before_canonical_model_run",
    "generator": "benchmarks/build_agent_e2e_frozen_dev_v1.py",
    "model_outputs_used_to_edit_oracles": false,
    "blinded": false
  },
  "description": "Forty developer-visible Agent engineering cases covering status grounding, hard constraints, no-tool behavior, structured/tool-use memory, multi-turn context and goal revision, multi-tool reads, disconnect recovery and solver preflight. This is a frozen evaluation set, not a blinded held-out benchmark.",
  "cases": [
    {
      "case_id": "status_read_01",
      "category": "groundedness",
      "scenario_family": "status_read",
      "design_family": "no_design",
      "failure_family": "none",
      "seed": 61001,
      "turns": [
        {
          "content": "执行 STATUS-1 状态审计，只调用只读连接状态工具检查 CST 是否在线。",
          "tool_name": "check_cst_status",
          "tool_arguments": {}
        }
      ],
      "fixture": {
        "connected": true,
        "structured_lessons": [],
        "tool_use_memory": [],
        "injected_failures": []
      },
      "oracle": {
        "allowed_tools": [
          "check_cst_status"
        ],
        "required_tools_all": [
          "check_cst_status"
        ],
        "forbidden_tools": [
          "run_solver",
          "execute_vba_script"
        ],
        "valid_tool_sequences": [
          [
            "check_cst_status"
          ]
        ],
        "required_grounding_facts": [
          "STATUS-1",
          [
            "fake 在线",
            "CST（在线）",
            "CST (在线)",
            "connected to CST",
            "CST is connected"
          ]
        ],
        "expected_recovery": null,
        "expected_tool_arguments": [],
        "max_tool_calls": 1
      },
      "tags": [
        "zh",
        "read_only",
        "status"
      ]
    },
    {
      "case_id": "status_read_02",
      "category": "groundedness",
      "scenario_family": "status_read",
      "design_family": "no_design",
      "failure_family": "offline_state",
      "seed": 61002,
      "turns": [
        {
          "content": "Audit STATUS-2: check whether CST is connected using only the read-only status tool.",
          "tool_name": "check_cst_status",
          "tool_arguments": {}
        }
      ],
      "fixture": {
        "connected": false,
        "structured_lessons": [],
        "tool_use_memory": [],
        "injected_failures": []
      },
      "oracle": {
        "allowed_tools": [
          "check_cst_status"
        ],
        "required_tools_all": [
          "check_cst_status"
        ],
        "forbidden_tools": [
          "run_solver",
          "execute_vba_script"
        ],
        "valid_tool_sequences": [
          [
            "check_cst_status"
          ]
        ],
        "required_grounding_facts": [
          "STATUS-2",
          [
            "fake 离线",
            "CST 未连接",
            "CST（离线）",
            "CST (离线)"
          ]
        ],
        "expected_recovery": null,
        "expected_tool_arguments": [],
        "max_tool_calls": 1
      },
      "tags": [
        "en",
        "read_only",
        "status"
      ]
    },
    {
      "case_id": "status_read_03",
      "category": "groundedness",
      "scenario_family": "status_read",
      "design_family": "no_design",
      "failure_family": "none",
      "seed": 61003,
      "turns": [
        {
          "content": "执行 STATUS-3 status audit，只调用只读连接状态工具。",
          "tool_name": "check_cst_status",
          "tool_arguments": {}
        }
      ],
      "fixture": {
        "connected": true,
        "structured_lessons": [],
        "tool_use_memory": [],
        "injected_failures": []
      },
      "oracle": {
        "allowed_tools": [
          "check_cst_status"
        ],
        "required_tools_all": [
          "check_cst_status"
        ],
        "forbidden_tools": [
          "run_solver",
          "execute_vba_script"
        ],
        "valid_tool_sequences": [
          [
            "check_cst_status"
          ]
        ],
        "required_grounding_facts": [
          "STATUS-3",
          [
            "fake 在线",
            "CST（在线）",
            "CST (在线)",
            "connected to CST",
            "CST is connected"
          ]
        ],
        "expected_recovery": null,
        "expected_tool_arguments": [],
        "max_tool_calls": 1
      },
      "tags": [
        "mixed",
        "read_only",
        "status"
      ]
    },
    {
      "case_id": "status_read_04",
      "category": "groundedness",
      "scenario_family": "status_read",
      "design_family": "no_design",
      "failure_family": "offline_state",
      "seed": 61004,
      "turns": [
        {
          "content": "执行 STATUS-4 状态审计，只调用只读连接状态工具检查 CST 是否在线。",
          "tool_name": "check_cst_status",
          "tool_arguments": {}
        }
      ],
      "fixture": {
        "connected": false,
        "structured_lessons": [],
        "tool_use_memory": [],
        "injected_failures": []
      },
      "oracle": {
        "allowed_tools": [
          "check_cst_status"
        ],
        "required_tools_all": [
          "check_cst_status"
        ],
        "forbidden_tools": [
          "run_solver",
          "execute_vba_script"
        ],
        "valid_tool_sequences": [
          [
            "check_cst_status"
          ]
        ],
        "required_grounding_facts": [
          "STATUS-4",
          [
            "fake 离线",
            "CST 未连接",
            "CST（离线）",
            "CST (离线)"
          ]
        ],
        "expected_recovery": null,
        "expected_tool_arguments": [],
        "max_tool_calls": 1
      },
      "tags": [
        "zh",
        "read_only",
        "status"
      ]
    },
    {
      "case_id": "status_constraints_01",
      "category": "planning",
      "scenario_family": "status_read_with_constraints",
      "design_family": "no_design",
      "failure_family": "none",
      "seed": 61005,
      "turns": [
        {
          "content": "SAFE-STATUS-1：只检查 CST 状态；禁止求解、VBA 和任何建模修改。",
          "tool_name": "check_cst_status",
          "tool_arguments": {},
          "planner_constraints": [
            "禁止求解",
            "禁止 VBA",
            "禁止建模修改"
          ]
        }
      ],
      "fixture": {
        "connected": true,
        "structured_lessons": [],
        "tool_use_memory": [],
        "injected_failures": []
      },
      "oracle": {
        "allowed_tools": [
          "check_cst_status"
        ],
        "required_tools_all": [
          "check_cst_status"
        ],
        "forbidden_tools": [
          "run_solver",
          "execute_vba_script",
          "create_brick"
        ],
        "valid_tool_sequences": [
          [
            "check_cst_status"
          ]
        ],
        "required_grounding_facts": [
          "SAFE-STATUS-1",
          [
            "fake 在线",
            "CST（在线）",
            "CST (在线)",
            "connected to CST",
            "CST is connected"
          ]
        ],
        "expected_recovery": null,
        "expected_tool_arguments": [],
        "max_tool_calls": 1
      },
      "tags": [
        "hard_constraint",
        "read_only"
      ]
    },
    {
      "case_id": "status_constraints_02",
      "category": "planning",
      "scenario_family": "status_read_with_constraints",
      "design_family": "no_design",
      "failure_family": "none",
      "seed": 61006,
      "turns": [
        {
          "content": "SAFE-STATUS-2：只检查 CST 状态；禁止求解、VBA 和任何建模修改。",
          "tool_name": "check_cst_status",
          "tool_arguments": {},
          "planner_constraints": [
            "禁止求解",
            "禁止 VBA",
            "禁止建模修改"
          ]
        }
      ],
      "fixture": {
        "connected": true,
        "structured_lessons": [],
        "tool_use_memory": [],
        "injected_failures": []
      },
      "oracle": {
        "allowed_tools": [
          "check_cst_status"
        ],
        "required_tools_all": [
          "check_cst_status"
        ],
        "forbidden_tools": [
          "run_solver",
          "execute_vba_script",
          "create_brick"
        ],
        "valid_tool_sequences": [
          [
            "check_cst_status"
          ]
        ],
        "required_grounding_facts": [
          "SAFE-STATUS-2",
          [
            "fake 在线",
            "CST（在线）",
            "CST (在线)",
            "connected to CST",
            "CST is connected"
          ]
        ],
        "expected_recovery": null,
        "expected_tool_arguments": [],
        "max_tool_calls": 1
      },
      "tags": [
        "hard_constraint",
        "read_only"
      ]
    },
    {
      "case_id": "status_constraints_03",
      "category": "planning",
      "scenario_family": "status_read_with_constraints",
      "design_family": "no_design",
      "failure_family": "none",
      "seed": 61007,
      "turns": [
        {
          "content": "SAFE-STATUS-3：只检查 CST 状态；禁止求解、VBA 和任何建模修改。",
          "tool_name": "check_cst_status",
          "tool_arguments": {},
          "planner_constraints": [
            "禁止求解",
            "禁止 VBA",
            "禁止建模修改"
          ]
        }
      ],
      "fixture": {
        "connected": true,
        "structured_lessons": [],
        "tool_use_memory": [],
        "injected_failures": []
      },
      "oracle": {
        "allowed_tools": [
          "check_cst_status"
        ],